{
  "contract_version": "finding-dialogue-input.v1",
  "run_id": "11111111-1111-4111-8111-111111111111",
  "dialogue_id": "90000000-0000-4000-8000-000000000001",
  "finding": {
    "id": "80000000-0000-4000-8000-000000000001",
    "ordinal": 1,
    "kind": "ambiguity",
    "title": "Не задано расписание обновления",
    "problem": "Термин «регулярно» не задаёт момент и период запуска.",
    "reason": "Разработчик и тестировщик не могут однозначно реализовать и проверить регламент.",
    "question": "С какой периодичностью, в какое время и в каком часовом поясе запускать обновление?",
    "priority": {
      "level": "high",
      "rationale": "Расписание влияет на доступность и проверяемость данных."
    },
    "anchors": [
      {
        "source_id": "source-main",
        "fragment_id": "source-main-lines-1-3",
        "quote": "Обновление витрины выполняется регулярно.",
        "quote_start": 0,
        "quote_end": 41
      }
    ],
    "scope": []
  },
  "sources": [
    {
      "id": "source-main",
      "role": "document",
      "name": "synthetic-spec.md",
      "media_type": "text/markdown",
      "sha256": "aaaaaaaaaaaaaaaaaaaaaaaaaaaaaaaaaaaaaaaaaaaaaaaaaaaaaaaaaaaaaaaa",
      "status": "available",
      "diagnostics": [],
      "fragments": [
        {
          "id": "source-main-lines-1-3",
          "kind": "text",
          "text": "Обновление витрины выполняется регулярно. Точное расписание не указано.",
          "location": {
            "line_start": 1,
            "line_end": 3
          }
        }
      ]
    },
    {
      "id": "source-context",
      "role": "context",
      "name": "review-rules.txt",
      "media_type": "text/plain",
      "sha256": "bbbbbbbbbbbbbbbbbbbbbbbbbbbbbbbbbbbbbbbbbbbbbbbbbbbbbbbbbbbbbbbb",
      "status": "unavailable",
      "diagnostics": [
        {
          "code": "not_found",
          "message": "Синтетический источник контекста недоступен в снимке запуска."
        }
      ],
      "fragments": []
    }
  ],
  "profile": {
    "id": "base-data-spec",
    "version": "1.0.0",
    "name": "Базовая проверка ТЗ на данные",
    "role": "Аналитик с ракурсами разработчика и тестировщика",
    "goal": "Найти неоднозначности до передачи ТЗ в разработку",
    "checks": [
      "Проверить расписание, временные зоны и повторный запуск"
    ]
  },
  "history": [
    {
      "turn_id": "91000000-0000-4000-8000-000000000001",
      "ordinal": 1,
      "member_message": {
        "message_id": "92000000-0000-4000-8000-000000000001",
        "content": "Обновление должно выполняться каждый день."
      },
      "assistant_message": {
        "message_id": "93000000-0000-4000-8000-000000000001",
        "action": "clarify",
        "content": "Уточните время запуска и часовой пояс.",
        "proposed_resolution": null,
        "anchors": []
      }
    }
  ],
  "current_turn": {
    "turn_id": "91000000-0000-4000-8000-000000000002",
    "ordinal": 2,
    "member_message": {
      "message_id": "92000000-0000-4000-8000-000000000002",
      "content": "Запускать каждый день в 06:00 по московскому времени."
    },
    "follow_up_allowed": false
  },
  "options": {
    "locale": "ru-RU"
  }
}
